{
  "date": "2026-06-09",
  "generatedBy": "grok",
  "version": 1,
  "news": [
    {
      "title": "WWDC26: Apple ra mắt Siri AI — agent xuyên app với personal context, onscreen awareness và app riêng",
      "summary": "WWDC26: Apple ra mắt Siri AI với personal context (Messages, Photos, Mail), onscreen awareness, web search, app actions xuyên hệ thống và app Siri riêng đồng bộ iCloud. iOS/macOS 27 tối ưu perf (app launch +30%, AirDrop +80%). Góc nhìn: Apple chọn agent deeply integrated + privacy-first thay vì chatbot rời — dev nên chuẩn bị App Intents/onscreen APIs sớm, nhưng timeline EU và lock-in ecosystem là rủi ro cho team cross-platform.",
      "source": "https://www.apple.com/newsroom/2026/06/apple-unveils-next-generation-of-apple-intelligence-siri-ai-and-more/",
      "tags": [
        "ai",
        "agent",
        "apple",
        "developer-productivity"
      ],
      "importance": 5
    },
    {
      "title": "DMA chặn Siri AI trên iPhone/iPad EU — Apple và EC không thống nhất permission model cho assistant",
      "summary": "Apple xác nhận Siri AI không ship trên iOS/iPadOS 27 tại EU vì DMA: EC từ chối đề xuất Trusted System Agent, yêu cầu mở quyền assistant khác truy cập data và điều khiển app không có guard tương đương. Chỉ macOS/visionOS EU có Siri AI; dev EU không test được trên iPhone. Góc nhìn: Đây là va chạm thực tế giữa agent capability và interoperability — builder agent cần thiết kế permission boundary rõ, không chỉ 'mở API cho mọi assistant'.",
      "source": "https://www.apple.com/newsroom/2026/06/due-to-dma-siri-ai-delayed-in-eu-for-ios-27-and-ipados-27/",
      "tags": [
        "ai",
        "agent",
        "regulation",
        "privacy"
      ],
      "importance": 4
    },
    {
      "title": "OpenAI nộp hồ sơ IPO kín lên SEC, đua race public market với Anthropic và SpaceX",
      "summary": "OpenAI nộp hồ sơ IPO kín lên SEC ngày 8/6, sau Anthropic một tuần. Valuation private ~852B USD; công ty thừa nhận chưa chốt timing, có thể giữ private lâu hơn. WSJ: miss target revenue/user, dự kiến burn ~85B USD năm 2028. Góc nhìn: IPO race AI lab là cuộc đua hút vốn public còn lại — engineer nên theo dõi capex/infra spend vì hiring và cloud pricing sẽ phản ứng nhanh với narrative 'path to profit' của từng lab.",
      "source": "https://techcrunch.com/2026/06/08/following-anthropic-openai-files-confidentially-for-ipo/",
      "tags": [
        "ai",
        "ipo",
        "startup",
        "ecosystem"
      ],
      "importance": 5
    },
    {
      "title": "New Relic AI Coding Observability: open-source telemetry thống nhất cho coding agent đa vendor",
      "summary": "New Relic công bố AI Coding Observability (open-source, GA 23/6): telemetry thống nhất cho Claude Code, Cursor, Copilot, Windsurf, Amazon Q qua OpenTelemetry/MCP. Theo dõi chi phí, productivity, compliance với local-only mode. Góc nhìn: Coding agent đang scale nhanh hơn observability — team dùng AI assistant mà không đo token/spend và output quality sẽ bị finance và security hỏi trước khi kịp có dashboard.",
      "source": "https://www.helpnetsecurity.com/2026/06/08/new-relic-ai-coding-observability/",
      "tags": [
        "ai",
        "developer-productivity",
        "observability",
        "open-source"
      ],
      "importance": 4
    },
    {
      "title": "Elastic agentic Kubernetes investigation: agent tự chẩn đoán incident trước khi SRE vào ticket",
      "summary": "Elastic ra agentic Kubernetes investigation workflow + MCP App: khi alert fire, agent tự phân tích logs/metrics/anomalies, gom evidence và đề xuất next step trước khi SRE mở ticket. Tích hợp Claude, Cursor, VS Code qua MCP. Góc nhìn: Agentic ops giảm MTTR nhưng đòi hỏi data foundation sạch — nếu Elasticsearch thiếu context hoặc alert noisy, agent chỉ tạo báo cáo đẹp mà vẫn sai root cause.",
      "source": "https://ir.elastic.co/News--Events/news/news-details/2026/Elastic-Observability-Gives-SREs-a-Head-Start-on-Kubernetes-Incident-Investigations/default.aspx",
      "tags": [
        "ai",
        "agent",
        "kubernetes",
        "devops"
      ],
      "importance": 4
    },
    {
      "title": "CVE-2026-50751: Qilin ransomware khai thác zero-day Check Point VPN IKEv1 auth bypass",
      "summary": "Check Point cảnh báo CVE-2026-50751: auth bypass IKEv1 trên VPN Remote/Mobile Access, Qilin ransomware affiliate đã khai thác từ đầu 5/2026. Attacker bypass password, vào VPN, exfil bằng Rclone. Góc nhìn: Legacy protocol (IKEv1) vẫn là cửa hậu phổ biến — team DevOps/SRE cần audit VPN config và patch ngay, không chỉ focus vào app layer khi perimeter đã bị xuyên thủng.",
      "source": "https://www.helpnetsecurity.com/2026/06/08/check-point-cve-2026-50751-qilin-ransomware/",
      "tags": [
        "security",
        "devops",
        "vpn",
        "ransomware"
      ],
      "importance": 4
    }
  ],
  "blog": null,
  "financeNews": [
    {
      "title": "OpenAI nộp IPO kín: valuation ~852B USD, burn dự kiến 85B USD năm 2028",
      "summary": "OpenAI nộp hồ sơ IPO kín 8/6 sau Anthropic, valuation private ~852B USD. Công ty thừa nhận chưa chốt timing IPO; WSJ báo miss target revenue/user và dự kiến burn ~85B USD năm 2028 dù doanh thu tăng gấp đôi. Góc nhìn: Cuộc đua IPO AI lab sẽ hút vốn public còn lại — investor phải pricing burn/capex chứ không chỉ WAU; builder nên chuẩn bị chu kỳ hiring/infra thắt chặt khi narrative chuyển sang profitability.",
      "source": "https://techcrunch.com/2026/06/08/following-anthropic-openai-files-confidentially-for-ipo/",
      "tags": [
        "ipo",
        "ai",
        "vc-startup"
      ],
      "importance": 5,
      "category": "vc-startup"
    },
    {
      "title": "Bitcoin hồi ~63-64k, Strategy mua 1.550 BTC và nâng cash reserve lên 1B USD",
      "summary": "Bitcoin hồi ~63-64k sau tuần giảm mạnh; Strategy mua thêm 1.550 BTC (~101M USD), nâng cash reserve lên 1B USD. Nasdaq +1.6% nhưng analyst cảnh báo ETF flow vẫn âm, CPI tháng 5 và Fed meeting 16-17/6 là test quan trọng. Góc nhìn: Bounce là relief trade quanh MA200, chưa phải bottom — crypto vẫn nhạy macro hơn narrative corporate BTC; builder DeFi/fintech không nên scale dựa trên giả định risk-on kéo dài.",
      "source": "https://www.coindesk.com/markets/2026/06/08/strategy-buys-1-550-bitcoin-boosts-cash-reserves-to-usd1-billion",
      "tags": [
        "crypto",
        "bitcoin",
        "macro"
      ],
      "importance": 4,
      "category": "crypto"
    },
    {
      "title": "Tech châu Á lao dốc: Samsung -10%, SoftBank -6% sau Broadcom miss và Nasdaq giảm >4.5%",
      "summary": "Cổ phiếu tech châu Á lao dốc 8/6: Samsung -10%, SK Hynix -7.7%, SoftBank -6.1% sau Nasdaq giảm >4.5% tuần trước. Broadcom earnings miss châm ngòi; UOB ước S&P 500 tech mất ~1.8T USD market cap. Goldman đẩy rate cut về 2027. Góc nhìn: Narrative AI capex 'vô hạn' đang va earnings thực tế — team scale GPU/infra cần ROI plan rõ, investor tránh all-in semi khi supply chain điều chỉnh.",
      "source": "https://www.cnbc.com/2026/06/08/softbank-samsung-tech-ai-stocks-asia-fall.html",
      "tags": [
        "market",
        "chip",
        "ai"
      ],
      "importance": 5,
      "category": "market"
    },
    {
      "title": "Ramp huy động 750M USD ở valuation 44B USD, pitch AI spend management cho enterprise",
      "summary": "Ramp huy động 750M USD, valuation 44B USD (gần gấp 3 lần năm trước). ARR >1B USD, FCF dương, 70k khách; pitch AI spend management và thẻ corporate cho agent. Góc nhìn: Fintech thắng khi gắn AI cost control — đây là signal enterprise sẵn trả tiền cho governance token/agent spend; builder B2B nên productize budget/audit sớm thay vì chỉ bán 'AI feature'.",
      "source": "https://techcrunch.com/2026/06/04/ramp-raises-750m-at-44b-valuation-as-investors-hunger-for-fintechs-with-an-ai-story/",
      "tags": [
        "fintech",
        "funding",
        "ai"
      ],
      "importance": 4,
      "category": "fintech"
    },
    {
      "title": "Galaxy Digital +25% sau khi CEO công bố campus data center AI 1.6GW tại Texas",
      "summary": "Galaxy Digital tăng 25% sau CEO Novogratz công bố campus data center 1.6GW, đã lease 50% và kỳ vọng full hết hè. Data center >50% giá trị công ty. Góc nhìn: Crypto firm pivot sang AI infra đang được market reward mạnh hơn pure trading — nhưng capex GW-scale đòi hỏi contract dài hạn; investor cần phân biệt 'AI story' và cash flow thực từ lease.",
      "source": "https://www.coindesk.com/business/2026/06/08/live-updates-bitcoin-above-usd63-400-as-strategy-adds-usd100-million-btc-in-latest-purchase",
      "tags": [
        "crypto",
        "ai",
        "infra"
      ],
      "importance": 3,
      "category": "crypto"
    }
  ],
  "expUpdate": null
}
